{
 "meta": {
  "clip": "conveyor_boxes",
  "fps": 30,
  "duration": 15.75,
  "units": "m",
  "up": "y",
  "notes": "direct translation of evidence (no VLM) | binder: game scale x8.57",
  "game_scale": 8.571428571428571
 },
 "style": {
  "background": "#8fb3d9"
 },
 "camera": {
  "intrinsics": {
   "fov_deg": 38.22737600307101,
   "aspect": 1.7619047619047619,
   "far": 857.1428571428571
  },
  "keyframes": [
   {
    "t": 0.0,
    "pos": [
     0.0005441422845021545,
     10.285714285714285,
     0.0002785960224184559
    ],
    "quat": [
     0.7423104523982144,
     -6.404790476082326e-07,
     0.048023720050669884,
     -0.6683329369202472
    ]
   },
   {
    "t": 0.75,
    "pos": [
     -0.028007300531849588,
     10.313355094193545,
     -0.0056720217862417455
    ],
    "quat": [
     0.7393515357613868,
     0.0013830113247591718,
     0.0466289227203153,
     -0.6717016729269754
    ]
   },
   {
    "t": 1.25,
    "pos": [
     0.015051746656152071,
     10.288880875254174,
     -0.03999583271589427
    ],
    "quat": [
     0.7382477348592514,
     0.0020859639433299885,
     0.048000194055321126,
     -0.6728164029661161
    ]
   },
   {
    "t": 2.0,
    "pos": [
     0.02233948892819697,
     10.259058525510776,
     -0.1021779748956871
    ],
    "quat": [
     0.7383067498715166,
     0.004661377531650071,
     0.04666359528806317,
     -0.672832760445311
    ]
   },
   {
    "t": 2.75,
    "pos": [
     0.018170917952874725,
     10.272229149650729,
     -0.08828584378083817
    ],
    "quat": [
     0.7383274047583657,
     0.0025366518009073357,
     0.04481283627487373,
     -0.672947262781727
    ]
   },
   {
    "t": 3.5,
    "pos": [
     0.02820214720959726,
     10.264816957407268,
     -0.07988471888634956
    ],
    "quat": [
     0.7401537182804477,
     0.0034122311449502865,
     0.04649072532029009,
     -0.6708199776791343
    ]
   },
   {
    "t": 4.0,
    "pos": [
     0.03866007760628527,
     10.264387475158527,
     -0.04341290380578076
    ],
    "quat": [
     0.74045502031949,
     0.002294146265724367,
     0.04599864769521913,
     -0.6705260801689864
    ]
   },
   {
    "t": 4.75,
    "pos": [
     -0.009143664883685274,
     10.261366668638427,
     0.01556069997927611
    ],
    "quat": [
     0.7398381986460056,
     0.004790860206024814,
     0.04347358005376231,
     -0.6713617023036308
    ]
   },
   {
    "t": 5.5,
    "pos": [
     0.03390509193819458,
     10.27022824789486,
     0.019433503726636735
    ],
    "quat": [
     0.739283160293051,
     0.0056358628722966075,
     0.0463184452867882,
     -0.6717761886097323
    ]
   },
   {
    "t": 6.25,
    "pos": [
     0.003364378459138742,
     10.285277576650591,
     0.022729025758686808
    ],
    "quat": [
     0.7386859911659789,
     0.007559238231285566,
     0.04570067773800141,
     -0.6724561788152335
    ]
   },
   {
    "t": 6.75,
    "pos": [
     0.025036662267648196,
     10.299371585162497,
     0.02362654815887628
    ],
    "quat": [
     0.7382736134294055,
     0.008223022979546352,
     0.04649298031832447,
     -0.6728468298120209
    ]
   },
   {
    "t": 7.5,
    "pos": [
     0.030720566422244452,
     10.282431493350753,
     0.009864998243602345
    ],
    "quat": [
     0.7380604262608904,
     0.008008599974794271,
     0.04568840223735146,
     -0.6731383508722666
    ]
   },
   {
    "t": 8.25,
    "pos": [
     0.047885466930337274,
     10.2468701444086,
     0.0027454223136369627
    ],
    "quat": [
     0.7371454653387005,
     0.008259179259201832,
     0.04678168594687146,
     -0.6740621801796355
    ]
   },
   {
    "t": 9.0,
    "pos": [
     0.02392569157519809,
     10.272895268192025,
     0.010132890621950932
    ],
    "quat": [
     0.7362761024210153,
     0.010149313212125104,
     0.04615412305149319,
     -0.6750291026099458
    ]
   },
   {
    "t": 9.5,
    "pos": [
     0.017094655035110064,
     10.262759281824222,
     -0.015714960364550404
    ],
    "quat": [
     0.7374851800489431,
     0.009802672781979627,
     0.04494375913054021,
     -0.6737949059838041
    ]
   },
   {
    "t": 10.25,
    "pos": [
     0.024238183941315255,
     10.274460597490803,
     0.01423415388075375
    ],
    "quat": [
     0.7373050584658907,
     0.008775416679528632,
     0.043882799227868724,
     -0.6740760660004453
    ]
   },
   {
    "t": 11.0,
    "pos": [
     0.03283914443134387,
     10.267163597799462,
     0.013820924120360322
    ],
    "quat": [
     0.7382658805259436,
     0.010493924556103892,
     0.046073305937124456,
     -0.6728525972891003
    ]
   },
   {
    "t": 11.75,
    "pos": [
     0.054995353959592624,
     10.275242467381728,
     -0.0003524351805243228
    ],
    "quat": [
     0.7389553004119119,
     0.012114852829852566,
     0.04680825119600139,
     -0.6720173226591886
    ]
   },
   {
    "t": 12.25,
    "pos": [
     0.05700462363119585,
     10.293401934405184,
     -0.022372680664760145
    ],
    "quat": [
     0.7398315865535204,
     0.012552697693811322,
     0.04540495058829224,
     -0.6711408524150376
    ]
   },
   {
    "t": 13.0,
    "pos": [
     0.09513701886664037,
     10.283750341522417,
     0.007890603181791212
    ],
    "quat": [
     0.7376433166943107,
     0.011768972890131499,
     0.04624815181976196,
     -0.673501994849744
    ]
   },
   {
    "t": 13.75,
    "pos": [
     0.06508203918243911,
     10.274285943926497,
     -0.001515900434531825
    ],
    "quat": [
     0.7381656720028371,
     0.01415334489740347,
     0.047005188266323564,
     -0.672831060356805
    ]
   },
   {
    "t": 14.5,
    "pos": [
     0.050003287298182854,
     10.27122604825855,
     0.0004732997973485232
    ],
    "quat": [
     0.7384786386106735,
     0.01487513381177244,
     0.047697274912648684,
     -0.6724232303212874
    ]
   },
   {
    "t": 15.0,
    "pos": [
     0.06458699147018548,
     10.276393286034963,
     0.015672270662092497
    ],
    "quat": [
     0.7376315258121621,
     0.013891131167888957,
     0.0468292397120949,
     -0.6734343256108093
    ]
   },
   {
    "t": 15.75,
    "pos": [
     0.057733869444315,
     10.279514098657819,
     0.006988702398458782
    ],
    "quat": [
     0.7377616687930268,
     0.01376983278741676,
     0.047186026770945314,
     -0.6732693299433047
    ]
   }
  ],
  "interp": "catmull_rom"
 },
 "static": [
  {
   "id": "ground",
   "class": "ground",
   "geom": {
    "kind": "primitive",
    "shape": "box",
    "extent": [
     23.999999999999996,
     2.571428571428571,
     23.999999999999996
    ]
   },
   "pose": {
    "pos": [
     -1.293440951869505,
     -1.2857142857142856,
     0.6942025474984789
    ]
   },
   "material": "grass",
   "confidence": 0.5
  },
  {
   "id": "conveyor_belt_1",
   "class": "conveyor belt",
   "geom": {
    "kind": "primitive",
    "shape": "box",
    "extent": [
     9.909852839031746,
     0.5084319367279518,
     0.6911066008250448
    ]
   },
   "pose": {
    "pos": [
     -2.2225947568131437,
     -0.02889369222236984,
     4.274305507527526
    ],
    "quat": [
     0.0,
     0.9994117862525194,
     0.0,
     0.034294044665925005
    ]
   },
   "material": "rubber",
   "confidence": 0.32769519090652466,
   "notes": "static structure from evidence"
  }
 ],
 "objects": [
  {
   "id": "metal_arm_2",
   "class": "metal arm",
   "confidence": 0.2584717869758606,
   "geom": {
    "kind": "asset",
    "query": "metal arm",
    "extent": [
     5.039424351449492,
     0.4285714285714286,
     0.9651322887523401
    ]
   },
   "pose": {
    "pos": [
     -5.303854969784341,
     0.20371971748855686,
     2.988397682452519
    ],
    "quat": [
     0.0,
     -0.5754283835448035,
     0.0,
     0.8178521721014222
    ]
   },
   "material": "default",
   "notes": "pos range 0.010 m (< 0.160), yaw range 2.7 deg",
   "support": "ground"
  },
  {
   "id": "cardboard_box_3",
   "class": "cardboard box",
   "confidence": 0.25018271803855896,
   "geom": {
    "kind": "asset",
    "query": "cardboard box",
    "extent": [
     1.1150427030316346,
     0.4285714285714286,
     0.4406728816532303
    ]
   },
   "pose": {
    "pos": [
     0.4411740497437787,
     0.2242857142857143,
     1.6088815214518608
    ],
    "quat": [
     0.0,
     -0.7100570956683089,
     0.0,
     0.7041441052022562
    ]
   },
   "material": "cardboard",
   "notes": "pos range 0.007 m (< 0.050), yaw range 1.4 deg lifted to ground",
   "support": "ground"
  }
 ],
 "binding": {
  "template": "platformer_3p",
  "slots": {
   "player_spawn": [
    0.0005441422845021545,
    1.2,
    0.0002785960224184559
   ],
   "goal_volume": {
    "pos": [
     -9.693440951869503,
     1.0,
     9.094202547498478
    ],
    "extent": [
     1.5,
     2.0,
     1.5
    ]
   },
   "walkable": "auto",
   "collectibles": [],
   "hazards": []
  }
 },
 "residual": null
}