{
 "meta": {
  "clip": "plarail_train",
  "fps": 30,
  "duration": 19.75,
  "units": "m",
  "up": "y",
  "notes": "generated | binder: game scale x4.00",
  "game_scale": 4.0
 },
 "style": {
  "background": "#f0f0f0"
 },
 "camera": {
  "intrinsics": {
   "fov_deg": 39.1,
   "aspect": 1.762,
   "far": 400.0
  },
  "keyframes": [
   {
    "t": 0,
    "pos": [
     0.0,
     4.8,
     0.0
    ],
    "quat": [
     -0.292,
     0,
     -0.042,
     0.955
    ]
   },
   {
    "t": 3.5,
    "pos": [
     1.2,
     5.132,
     0.488
    ],
    "quat": [
     -0.205,
     -0.196,
     -0.042,
     0.958
    ]
   },
   {
    "t": 6.75,
    "pos": [
     2.348,
     4.436,
     1.22
    ],
    "quat": [
     -0.253,
     -0.447,
     -0.064,
     0.856
    ]
   },
   {
    "t": 9.5,
    "pos": [
     1.04,
     4.268,
     0.672
    ],
    "quat": [
     -0.311,
     -0.266,
     -0.091,
     0.908
    ]
   },
   {
    "t": 12,
    "pos": [
     0.316,
     5.02,
     -0.012
    ],
    "quat": [
     -0.259,
     -0.239,
     -0.089,
     0.932
    ]
   },
   {
    "t": 15.5,
    "pos": [
     2.256,
     4.884,
     0.836
    ],
    "quat": [
     -0.22,
     -0.428,
     -0.095,
     0.871
    ]
   },
   {
    "t": 18,
    "pos": [
     3.06,
     4.244,
     1.576
    ],
    "quat": [
     -0.275,
     -0.493,
     -0.094,
     0.82
    ]
   },
   {
    "t": 19.75,
    "pos": [
     2.452,
     3.916,
     1.292
    ],
    "quat": [
     -0.327,
     -0.383,
     -0.062,
     0.862
    ]
   }
  ]
 },
 "static": [
  {
   "id": "ground",
   "class": "ground",
   "geom": {
    "kind": "primitive",
    "shape": "box",
    "extent": [
     24.0,
     1.2,
     20.0
    ]
   },
   "pose": {
    "pos": [
     8.664,
     0.0,
     -6.46
    ]
   },
   "material": "wood"
  },
  {
   "id": "table",
   "class": "table",
   "geom": {
    "kind": "primitive",
    "shape": "box",
    "extent": [
     6.0,
     3.2,
     4.0
    ]
   },
   "pose": {
    "pos": [
     2.0,
     1.6,
     2.0
    ]
   },
   "material": "white"
  },
  {
   "id": "wall",
   "class": "wall",
   "geom": {
    "kind": "primitive",
    "shape": "box",
    "extent": [
     0.8,
     6.0,
     8.0
    ]
   },
   "pose": {
    "pos": [
     8.0,
     3.0,
     -8.0
    ]
   },
   "material": "white"
  },
  {
   "id": "track",
   "class": "track",
   "geom": {
    "kind": "primitive",
    "shape": "box",
    "extent": [
     0.4,
     0.2,
     16.0
    ]
   },
   "pose": {
    "pos": [
     0.0,
     0.4,
     0.0
    ]
   },
   "material": "blue"
  }
 ],
 "objects": [
  {
   "id": "toy_train_2",
   "class": "toy_train",
   "confidence": 0.44,
   "geom": {
    "kind": "asset",
    "query": "toy train",
    "extent": [
     5.972,
     0.94,
     2.772
    ]
   },
   "pose": {
    "pos": [
     1.404,
     1.0799999999999998,
     -4.052
    ],
    "quat": [
     0.0,
     -0.545,
     0.0,
     0.838
    ]
   },
   "support": "ground",
   "motion": {
    "type": "trajectory",
    "keyframes": [
     {
      "t": 0,
      "pos": [
       1.404,
       1.0799999999999998,
       -4.052
      ]
     },
     {
      "t": 3.5,
      "pos": [
       4.4,
       1.0799999999999998,
       -5.524
      ]
     },
     {
      "t": 6.75,
      "pos": [
       3.568,
       1.0799999999999998,
       -3.04
      ]
     },
     {
      "t": 9.5,
      "pos": [
       3.808,
       1.0799999999999998,
       -3.904
      ]
     },
     {
      "t": 12,
      "pos": [
       2.76,
       1.0799999999999998,
       -3.108
      ]
     },
     {
      "t": 15.5,
      "pos": [
       3.972,
       1.0799999999999998,
       -2.664
      ]
     },
     {
      "t": 18,
      "pos": [
       3.772,
       1.0799999999999998,
       -2.588
      ]
     },
     {
      "t": 19.75,
      "pos": [
       3.388,
       1.0799999999999998,
       -2.468
      ]
     }
    ],
    "interp": "catmull_rom"
   },
   "notes": "lifted to ground"
  },
  {
   "id": "toy_train_3",
   "class": "toy_train",
   "confidence": 0.29,
   "geom": {
    "kind": "asset",
    "query": "toy train",
    "extent": [
     4.576,
     0.736,
     1.472
    ]
   },
   "pose": {
    "pos": [
     0.4,
     0.978,
     -4.52
    ],
    "quat": [
     0.0,
     -0.646,
     0.0,
     0.764
    ]
   },
   "support": "ground",
   "motion": {
    "type": "trajectory",
    "keyframes": [
     {
      "t": 0,
      "pos": [
       0.4,
       0.978,
       -4.52
      ]
     },
     {
      "t": 3.5,
      "pos": [
       6.992,
       0.978,
       -6.596
      ]
     },
     {
      "t": 6.75,
      "pos": [
       12.3,
       0.978,
       -2.984
      ]
     },
     {
      "t": 9.5,
      "pos": [
       4.492,
       0.978,
       -2.72
      ]
     },
     {
      "t": 12,
      "pos": [
       0.568,
       0.978,
       -6.36
      ]
     },
     {
      "t": 15.5,
      "pos": [
       0.66,
       0.978,
       -7.48
      ]
     },
     {
      "t": 18,
      "pos": [
       1.304,
       0.978,
       -5.06
      ]
     },
     {
      "t": 19.75,
      "pos": [
       2.456,
       0.978,
       -3.644
      ]
     }
    ],
    "interp": "catmull_rom"
   },
   "notes": "lifted to ground"
  }
 ],
 "binding": {
  "template": "platformer_3p",
  "slots": {
   "player_spawn": [
    0.26399999999999935,
    1.7999999999999998,
    -0.0007449293412772398
   ],
   "goal_volume": {
    "pos": [
     17.064,
     1.6,
     -13.46
    ],
    "extent": [
     1.5,
     2.0,
     1.5
    ]
   },
   "walkable": "auto",
   "collectibles": [],
   "hazards": []
  }
 },
 "residual": null
}